{
  "schema_version": 1,
  "id": "M0032-audit-diagonal-noise-robust-estimator",
  "sequence": 32,
  "title": "Audit diagonal-noise robust estimator",
  "kind": "user-request",
  "status": "closed",
  "opened_at": "2026-06-06T17:02:28Z",
  "closed_at": "2026-06-06T17:10:16Z",
  "start_commit": "38bf973c82512257f4dacac2502a04397ce055f1",
  "snapshot_ref": "manuscript-milestones/M0032-audit-diagonal-noise-robust-estimator",
  "summary": "Completed the M37 post-M0030 diagonal-noise robust estimator audit and marked M37 done.",
  "user_inputs": [
    {
      "id": "U0032-001",
      "milestone_id": "M0032-audit-diagonal-noise-robust-estimator",
      "captured_at": "2026-06-06T17:02:28Z",
      "source": "chat",
      "text": "Work on manuscript. Pick next task and work on it in /goal mode. Chosen task: M37, audit the M0030 diagonal-noise robust estimator."
    }
  ],
  "agent_actions": [
    {
      "id": "A0032-001",
      "milestone_id": "M0032-audit-diagonal-noise-robust-estimator",
      "captured_at": "2026-06-06T17:09:35Z",
      "description": "Selected M37 from the task board as the next priority manuscript task."
    },
    {
      "id": "A0032-002",
      "milestone_id": "M0032-audit-diagonal-noise-robust-estimator",
      "captured_at": "2026-06-06T17:09:35Z",
      "description": "Created manuscript/derivations/m37-diagonal-noise-robust-estimator-audit.md with a conditional pass and theorem-language caveats."
    },
    {
      "id": "A0032-003",
      "milestone_id": "M0032-audit-diagonal-noise-robust-estimator",
      "captured_at": "2026-06-06T17:09:35Z",
      "description": "Updated the task board, registry, dashboard, paper map, paper plan, source packet, workplan, review log, and human transparency logs."
    }
  ],
  "checks": [
    {
      "captured_at": "2026-06-06T17:09:35Z",
      "description": "python -m json.tool manuscript/formal-object-registry.json: passed"
    },
    {
      "captured_at": "2026-06-06T17:09:35Z",
      "description": "git diff --check: passed with line-ending warnings only"
    },
    {
      "captured_at": "2026-06-06T17:09:35Z",
      "description": "python scripts/check_manuscript.py: passed before closure with expected open-milestone warning"
    },
    {
      "captured_at": "2026-06-06T17:10:16Z",
      "description": "python scripts/check_manuscript.py: passed after closure"
    }
  ],
  "changed_files": [
    "manuscript/codex-log.md",
    "manuscript/decision-log.md",
    "manuscript/derivations/dw-noise-robust-moments.md",
    "manuscript/derivations/dw-robust-comparison-diagnostic.md",
    "manuscript/derivations/m37-diagonal-noise-robust-estimator-audit.md",
    "manuscript/formal-object-registry.json",
    "manuscript/paper-map.md",
    "manuscript/paper-plan.md",
    "manuscript/project-dashboard.md",
    "manuscript/review-log.md",
    "manuscript/session-log.md",
    "manuscript/source-packet.md",
    "manuscript/task-board.md",
    "manuscript/transparency/agent-actions.jsonl",
    "manuscript/transparency/milestones/M0032-audit-diagonal-noise-robust-estimator.json",
    "manuscript/transparency/timeline.json",
    "manuscript/transparency/user-input.jsonl",
    "manuscript/user-input-log.md",
    "manuscript/workplan.md"
  ],
  "github": {
    "repository": "Saschakew/Manuscript-NoisySignRestrictions",
    "milestone_number": 29,
    "milestone_url": "https://github.com/Saschakew/Manuscript-NoisySignRestrictions/milestone/29",
    "tag_name": "manuscript-milestones/M0032-audit-diagonal-noise-robust-estimator"
  }
}
