{
  "schema_version": 1,
  "id": "M0069-increase-figure-1-3-grid-density",
  "sequence": 69,
  "title": "Increase Figure 1-3 grid density",
  "kind": "user-request",
  "status": "closed",
  "opened_at": "2026-06-12T20:15:47Z",
  "closed_at": "2026-06-12T21:30:39Z",
  "start_commit": "5fca5bf5f21a51f5fc7817df409d193efe0a72aa",
  "snapshot_ref": "manuscript-milestones/M0069-increase-figure-1-3-grid-density",
  "summary": "Regenerated Figures 1-3 with denser 41/11/7 grids while preserving the M71 method and M72 layout.",
  "user_inputs": [
    {
      "id": "U0069-001",
      "milestone_id": "M0069-increase-figure-1-3-grid-density",
      "captured_at": "2026-06-12T20:15:47Z",
      "source": "chat",
      "text": "Plan and execute a task: first figure 1,2,3 with more grid points."
    }
  ],
  "agent_actions": [
    {
      "id": "A0069-001",
      "milestone_id": "M0069-increase-figure-1-3-grid-density",
      "captured_at": "2026-06-12T21:30:39Z",
      "description": "Raised Figure 1-3 grid defaults and refreshed PNG, Markdown, and JSON diagnostics."
    }
  ],
  "checks": [
    {
      "captured_at": "2026-06-12T21:30:39Z",
      "description": "python scripts/check_manuscript.py: passed with expected open-milestone warning before close"
    }
  ],
  "changed_files": [
    "manuscript/codex-log.md",
    "manuscript/decision-log.md",
    "manuscript/figures/fig_sign_dw_unit_variance_noise_grid.png",
    "manuscript/figures/fig_sign_dw_unit_variance_nongaussianity_grid.png",
    "manuscript/figures/fig_sign_dw_unit_variance_sample_size_grid.png",
    "manuscript/formal-object-registry.json",
    "manuscript/paper-map.md",
    "manuscript/project-dashboard.md",
    "manuscript/session-log.md",
    "manuscript/simulations/output/sign_dw_unit_variance_noise_grid_figure.json",
    "manuscript/simulations/output/sign_dw_unit_variance_nongaussianity_grid_figure.json",
    "manuscript/simulations/output/sign_dw_unit_variance_sample_size_grid_figure.json",
    "manuscript/simulations/sign_dw_unit_variance_noise_grid_figure.md",
    "manuscript/simulations/sign_dw_unit_variance_noise_grid_figure.py",
    "manuscript/simulations/sign_dw_unit_variance_nongaussianity_grid_figure.md",
    "manuscript/simulations/sign_dw_unit_variance_sample_size_grid_figure.md",
    "manuscript/source-packet.md",
    "manuscript/task-board.md",
    "manuscript/tasks/M73-increase-figure-grid-density/outcome.md",
    "manuscript/tasks/M73-increase-figure-grid-density/task.md",
    "manuscript/transparency/active-milestone.json",
    "manuscript/transparency/agent-actions.jsonl",
    "manuscript/transparency/milestones/M0069-increase-figure-1-3-grid-density.json",
    "manuscript/transparency/timeline.json",
    "manuscript/transparency/user-input.jsonl",
    "manuscript/user-input-log.md"
  ],
  "github": {
    "repository": "",
    "milestone_number": null,
    "milestone_url": "",
    "tag_name": "manuscript-milestones/M0069-increase-figure-1-3-grid-density"
  }
}
