{
  "schema_version": 1,
  "id": "M0046-improve-task-handoff-workflow",
  "sequence": 46,
  "title": "Improve task handoff workflow",
  "kind": "user-request",
  "status": "closed",
  "opened_at": "2026-06-09T08:11:20Z",
  "closed_at": "2026-06-09T08:28:19Z",
  "start_commit": "5b298b927dd336a0848d44778d17083daa963c75",
  "snapshot_ref": "manuscript-milestones/M0046-improve-task-handoff-workflow",
  "summary": "Improved manuscript task hand-off workflow by adding task-packet rules, a reusable packet template, and a self-contained M49 packet preserving the original user prompt and scientific acceptance criteria.",
  "user_inputs": [
    {
      "id": "U0046-001",
      "milestone_id": "M0046-improve-task-handoff-workflow",
      "captured_at": "2026-06-09T08:11:20Z",
      "source": "chat",
      "text": "Improve manuscript task creation and management so fragile scientific tasks use self-contained hand-off packets rather than thin task-board rows, and create the packet structure needed for M49."
    }
  ],
  "agent_actions": [
    {
      "id": "A0046-001",
      "milestone_id": "M0046-improve-task-handoff-workflow",
      "captured_at": "2026-06-09T08:28:19Z",
      "description": "Updated the local manuscript skill, manuscript rules, task board, dashboard, paper map, workplan, formal registry, decision/user/session/Codex logs, and created manuscript/tasks/_template.md plus manuscript/tasks/M49-dw-source-and-noisy-moment-audit.md."
    }
  ],
  "checks": [
    {
      "captured_at": "2026-06-09T08:28:19Z",
      "description": "skill quick_validate.py: passed; python scripts/check_manuscript.py: passed with expected open-milestone warning before closure; python -m json.tool manuscript/formal-object-registry.json: passed; git diff --check: passed with line-ending warnings only"
    }
  ],
  "changed_files": [
    ".codex/skills/write-standalone-manuscript/SKILL.md",
    ".codex/skills/write-standalone-manuscript/references/task-packet-workflow.md",
    "manuscript/codex-log.md",
    "manuscript/decision-log.md",
    "manuscript/formal-object-registry.json",
    "manuscript/manuscript-rules.md",
    "manuscript/paper-map.md",
    "manuscript/project-dashboard.md",
    "manuscript/session-log.md",
    "manuscript/task-board.md",
    "manuscript/tasks/M49-dw-source-and-noisy-moment-audit.md",
    "manuscript/tasks/_template.md",
    "manuscript/transparency/active-milestone.json",
    "manuscript/transparency/agent-actions.jsonl",
    "manuscript/transparency/milestones/M0046-improve-task-handoff-workflow.json",
    "manuscript/transparency/timeline.json",
    "manuscript/transparency/user-input.jsonl",
    "manuscript/user-input-log.md",
    "manuscript/workplan.md"
  ],
  "github": {
    "repository": "Saschakew/Manuscript-NoisySignRestrictions",
    "milestone_number": 42,
    "milestone_url": "https://github.com/Saschakew/Manuscript-NoisySignRestrictions/milestone/42",
    "tag_name": "manuscript-milestones/M0046-improve-task-handoff-workflow"
  }
}
