{
  "schema_version": 1,
  "id": "M0065-execute-m69-extended-mc",
  "sequence": 65,
  "title": "Execute M69 extended MC",
  "kind": "user-request",
  "status": "closed",
  "opened_at": "2026-06-12T16:03:53Z",
  "closed_at": "2026-06-12T16:17:45Z",
  "start_commit": "6631d25497c2e50d035dcfe0bbeb625d9dfcbf8c",
  "snapshot_ref": "manuscript-milestones/M0065-execute-m69-extended-mc",
  "summary": "Implemented and ran M69 extended three-block Monte Carlo with truth-inclusion counts and mean/median inverted-set size shares.",
  "user_inputs": [
    {
      "id": "U0065-001",
      "milestone_id": "M0065-execute-m69-extended-mc",
      "captured_at": "2026-06-12T16:03:53Z",
      "source": "chat",
      "text": "Work on M69 in /goal mode: implement and run the extended three-block Monte Carlo across the three active figure variations, leaving draft interpretation for M70."
    },
    {
      "id": "U0065-002",
      "milestone_id": "M0065-execute-m69-extended-mc",
      "captured_at": "2026-06-12T16:08:00Z",
      "source": "chat",
      "text": "Clarification during M69: the Monte Carlo must measure the size of the inverted set, report a mean or median size summary, and count how often the true B0 is in the set."
    }
  ],
  "agent_actions": [
    {
      "id": "A0065-001",
      "milestone_id": "M0065-execute-m69-extended-mc",
      "captured_at": "2026-06-12T16:17:45Z",
      "description": "Added m69_extended_three_block_mc.py, generated canonical M69 Markdown/JSON outputs, added extended-mc replication stage, and updated task/log/planning surfaces."
    }
  ],
  "checks": [
    {
      "captured_at": "2026-06-12T16:17:45Z",
      "description": "python scripts/check_manuscript.py: passed with expected open-milestone warning before close"
    }
  ],
  "changed_files": [
    "manuscript/QUESTION-INDEX.md",
    "manuscript/codex-log.md",
    "manuscript/project-dashboard.md",
    "manuscript/replication/README.md",
    "manuscript/replication/run_all.py",
    "manuscript/session-log.md",
    "manuscript/simulations/README.md",
    "manuscript/simulations/m69_extended_three_block_mc.md",
    "manuscript/simulations/m69_extended_three_block_mc.py",
    "manuscript/simulations/output/m69_extended_three_block_mc.json",
    "manuscript/source-packet.md",
    "manuscript/task-board.md",
    "manuscript/tasks/M69-extended-three-block-mc/outcome.md",
    "manuscript/tasks/M69-extended-three-block-mc/task.md",
    "manuscript/tasks/M70-extended-mc-draft-documentation/outcome.md",
    "manuscript/tasks/M70-extended-mc-draft-documentation/task.md",
    "manuscript/transparency/active-milestone.json",
    "manuscript/transparency/agent-actions.jsonl",
    "manuscript/transparency/milestones/M0065-execute-m69-extended-mc.json",
    "manuscript/transparency/timeline.json",
    "manuscript/transparency/user-input.jsonl",
    "manuscript/user-input-log.md"
  ],
  "github": {
    "repository": "Saschakew/Manuscript-NoisySignRestrictions",
    "milestone_number": 60,
    "milestone_url": "https://github.com/Saschakew/Manuscript-NoisySignRestrictions/milestone/60",
    "tag_name": "manuscript-milestones/M0065-execute-m69-extended-mc"
  }
}
